{
  "ticker": "AAPL",
  "output_mode": "C",
  "run_context": {
    "run_id": "20260328T000000Z_AAPL_C",
    "ticker": "AAPL",
    "artifact_root": "output/runs/20260328T000000Z_AAPL_C/AAPL"
  },
  "source_patch_plan_path": "evals/fixtures/patch-plan-aapl-needs-patch.json",
  "analysis_patch_path": "evals/fixtures/analysis-patch-aapl-valid.json",
  "analysis_result_path": "output/runs/20260328T000000Z_AAPL_C/AAPL/analysis-result.json",
  "quality_report_path": "evals/fixtures/quality-report-critic-recheck-valid.json",
  "render": {
    "required": true,
    "status": "rendered",
    "engine": "dashboard-generator",
    "report_output_path": "output/reports/AAPL_C_EN_2026-03-28.html",
    "rendered_at": "2026-03-28T02:30:00Z",
    "notes": [
      "Mode C dashboard rerender completed successfully."
    ]
  },
  "recheck": {
    "status": "applied",
    "critic_overall_before": "FAIL",
    "critic_overall_after": "PASS",
    "remaining_fail_count": 0,
    "quality_report_updated": true,
    "recheck_payload_path": "evals/fixtures/critic-recheck-pass.json",
    "remaining_fail_items": []
  },
  "next_patch_plan": {
    "path": "evals/fixtures/patch-plan-aapl-ready.json",
    "pending_fix_count": 0,
    "ready_for_redelivery": true,
    "loop_state": "ready_for_delivery"
  },
  "quality_gate": {
    "overall_result": "PASS",
    "delivery_gate_result": "PASS",
    "critic_overall": "PASS",
    "blocking_items": [],
    "non_blocking_items": [],
    "historical_only_items": [],
    "delivery_ready": true
  },
  "completed_by": "patch-loop-orchestrator",
  "completed_at": "2026-03-28T02:30:00Z"
}
