{
  "ticker": "NVDA",
  "output_mode": "A",
  "run_context": {
    "run_id": "20260313T000000Z_NVDA_A_LEGACY",
    "artifact_root": "output/runs/20260313T000000Z_NVDA_A_LEGACY/NVDA",
    "ticker": "NVDA",
    "reports_dir": "output/reports",
    "snapshot_dir": "output/data/NVDA",
    "migration_mode": "legacy_promotion"
  },
  "source_patch_plan_path": "output/runs/20260313T000000Z_NVDA_A_LEGACY/NVDA/patch-plan.json",
  "analysis_patch_path": "evals/fixtures/analysis-patch-nvda-valid.json",
  "analysis_result_path": "output/runs/20260313T000000Z_NVDA_A_LEGACY/NVDA/analysis-result.json",
  "quality_report_path": "output/runs/20260313T000000Z_NVDA_A_LEGACY/NVDA/quality-report.json",
  "render": {
    "required": true,
    "status": "rendered",
    "engine": "briefing-generator",
    "report_output_path": "output/reports/NVDA_A_en_2026-03-13.html",
    "rendered_at": "2026-03-28T04:10:00Z",
    "notes": [
      "Mode A briefing rerender completed successfully."
    ]
  },
  "recheck": {
    "status": "applied",
    "critic_overall_before": "FAIL",
    "critic_overall_after": "PASS",
    "remaining_fail_count": 0,
    "quality_report_updated": true,
    "recheck_payload_path": "evals/fixtures/critic-recheck-mode-a-pass.json",
    "remaining_fail_items": []
  },
  "next_patch_plan": {
    "path": "output/runs/20260313T000000Z_NVDA_A_LEGACY/NVDA/patch-plan.json",
    "pending_fix_count": 0,
    "ready_for_redelivery": true,
    "loop_state": "ready_for_delivery"
  },
  "quality_gate": {
    "overall_result": "PASS",
    "delivery_gate_result": "PASS",
    "critic_overall": "PASS",
    "blocking_items": [],
    "non_blocking_items": [],
    "historical_only_items": [],
    "delivery_ready": true
  },
  "completed_by": "patch-loop-orchestrator",
  "completed_at": "2026-03-28T04:10:00Z"
}
